{
    "product_id": "SW_MTI_SHA_2C",
    "definition": "Spherical harmonic model of the magnetic signature of oceanic M2 tide",
    "applicable_missions": [
        "Swarm"
    ],
    "applicable_spacecraft": [
        "Swarm-A",
        "Swarm-B",
        "Swarm-C"
    ],
    "thematic_areas": [
        "Ocean Tides"
    ],
    "authors": [
        {
            "name": "European Space Agency",
            "ror": "https://ror.org/03wd9za21"
        },
        {
            "name": "Technical University of Denmark",
            "ror": "https://ror.org/04qtj9h94"
        }
    ],
    "creation_year": 2018,
    "product_types": [
        "SW_OPER_MTI_SHA_2C"
    ],
    "identifiers": [
        {
            "identifier": "https://swarmhandbook.earth.esa.int/catalogue/SW_MTI_SHA_2C",
            "identifierType": "URL"
        },
        {
            "identifier": "10.57780/esa-f069715",
            "identifierType": "DOI",
            "role": "concept",
            "primary": true,
            "citation": {
                "text": "European Space Agency, Technical University of Denmark, 2018, \"SW_MTI_SHA_2C\", European Space Agency, https://doi.org/10.57780/esa-f069715",
                "bibtex": "@misc{SW_MTI_SHA_2C,\n  author = {{European Space Agency} and {Technical University of Denmark}},\n  title = {SW_MTI_SHA_2C},\n  year = {2018},\n  publisher = {European Space Agency},\n  doi = {10.57780/esa-f069715},\n  url = {https://doi.org/10.57780/esa-f069715},\n}"
            }
        }
    ],
    "description": "This product contains the representation of a model of the magnetic field of the Lunar M<sub>2</sub> ocean tides using spherical harmonic coefficients. The model is estimated from Swarm and ground observatory data using the Comprehensive Inversion scheme within the Swarm Level 2 Processing system.",
    "link_files_http": "https://swarm-diss.eo.esa.int/#swarm/Level2longterm/MTI",
    "link_files_ftp": "ftp://swarm-diss.eo.esa.int/Level2longterm/MTI",
    "link_vires_gui": "",
    "link_notebook": "",
    "link_hapi": "",
    "variables_table": "",
    "related_resources": "Part of the CI (comprehensive inversion) chain, related to the \"CM\" model series, see e.g.:\n\nSabaka, T.J., Tøffner-Clausen, L., Olsen, N. et al. CM6: a comprehensive geomagnetic field model derived from both CHAMP and Swarm satellite observations. Earth Planets Space 72, 80 (2020). https://doi.org/10.1186/s40623-020-01210-5",
    "details": "",
    "changelog": "",
    "fast_processing": false
}
