{
    "product_id": "SW_MIO_SHA_2D",
    "definition": "Model of non-polar daily geomagnetic variation caused by ionospheric currents, derived from dedicated chain (DIFI)",
    "applicable_missions": [
        "CHAMP",
        "Swarm"
    ],
    "applicable_spacecraft": [
        "CHAMP",
        "Swarm-A",
        "Swarm-B",
        "Swarm-C"
    ],
    "thematic_areas": [
        "Ionosphere/Magnetosphere"
    ],
    "authors": [
        {
            "name": "European Space Agency",
            "ror": "https://ror.org/03wd9za21"
        },
        {
            "name": "Institut de physique du globe de Paris",
            "ror": "https://ror.org/004gzqz66"
        }
    ],
    "creation_year": 2015,
    "product_types": [
        "SW_OPER_MIO_SHA_2D"
    ],
    "identifiers": [
        {
            "identifier": "https://swarmhandbook.earth.esa.int/catalogue/SW_MIO_SHA_2D",
            "identifierType": "URL"
        },
        {
            "identifier": "10.57780/esa-6079355",
            "identifierType": "DOI",
            "role": "concept",
            "primary": true,
            "citation": {
                "text": "European Space Agency, Institut de physique du globe de Paris, 2015, \"SW_MIO_SHA_2D\", European Space Agency, https://doi.org/10.57780/esa-6079355",
                "bibtex": "@misc{SW_MIO_SHA_2D,\n  author = {{European Space Agency} and {Institut de physique du globe de Paris}},\n  title = {SW_MIO_SHA_2D},\n  year = {2015},\n  publisher = {European Space Agency},\n  doi = {10.57780/esa-6079355},\n  url = {https://doi.org/10.57780/esa-6079355},\n}"
            }
        }
    ],
    "description": "Model of non-polar daily geomagnetic variation caused by ionospheric currents, including their variability with season and solar flux, derived in Dedicated Ionospheric Field Inversion chain",
    "link_files_http": "https://swarm-diss.eo.esa.int/#swarm/Level2longterm/MIO",
    "link_files_ftp": "ftp://swarm-diss.eo.esa.int/Level2longterm/MIO",
    "link_vires_gui": "https://vires.services?ws=data%3Aapplication/json%2Bgzip%3Bbase64%2CH4sIAMta5mMC/51Va0/bMBT9K1W%2Bro38iF98K4UOJB4TZQOKqig0pngySZWkHQj1v%2B/a9JGGwaCS1cbH95xzc%2B1cvwSlLuZmrH/pojR5Fuy1AhpiHKKg3Qoq86gH2upx9bp0GxCEeQdhGJcI7fkRIoSGLrq2RugeUzBCpdQwGC2lDvLHxKx1WAeTDoVY8p4OuURba05nbvSfekrBxOZ32tGmRZ7OxlXZy7N7M5kVyTLiJRhcxec/Di/i0%2B73bnxyEeN9D89Nae6shuf7xJYaJPJZZU2myzo0TcamegYEO4%2BkSB51BbXyCvvx2WHPPxVJNnFKt5hBqu0Wc38u33Fu86IcJ94n%2BK2rYAFo/6skAEv/1joFqCpm2sl4/7jQZbeRRYc7Pf5RCmtufJqn2m7zgSzYe%2BSFo29ImzK6tLZKhkLxtmj9XQp29CY/En2lUtcNU%2BRNCf3Q9KZRVOFJ4p%2Bc1Mx1MTHZJMaeO2xwiff7DPO4wZRAlJ/gHezI6xtt09Wxr9eo3YrQh/W5jg%2BvGqYMdvL/lje7Eoc7ERd%2B%2BXGaZzqr3FvevgTGnY7g9Pg8Hhx1Y3Lgz42Z%2BJbyLWie2mxm7WL0KgRokfzIS7PuL9PNBI4zQ5JiFQrJCaaUt1sdwjESnJGQRYxGRMl2i0aYIMajEAtJOIm4e4XUFJtW20EhpSoiHCnEpAQm0FDIBBKCc5CM4JfAJkGgiABiXBIElhDuxGbTpQpSICEkNFyJqFSSOBnBFWcUCy5UJKhgDuMUYykFVkIoJRR1KoWZPFT%2BiwsVZQJjRBmRTCmOHYVIlx5IKAoOSgqfDkEcjBSMiED%2Bko1c4Z66T6bcat0n0KKrWfravW1eNTs3bNOzI/kbo%2B/bv5%2BfJHe%2B97hdcRhZBY3Ws0aIPxyrKIeN6iDxXMhxy6/WG0dvXD4l6LAyqbS1plp%2BXV07fUhq18t%2Bkczz2rz3kBTW1O%2Bks0GvNvsJdUrSFbBY/AV5nMEywAcAAA%3D%3D",
    "link_notebook": "",
    "link_hapi": "",
    "variables_table": "",
    "related_resources": "",
    "details": "<table border=\"1\">\n\t<thead>\n\t\t<tr>\n\t\t\t<th>Product identifier</th>\n\t\t\t<th>MIO_SHA_2D</th>\n\t\t</tr>\n\t</thead>\n\t<tbody>\n\t\t<tr>\n\t\t\t<td>Definition</td>\n\t\t\t<td>Spherical harmonic representation of the daily geomagnetic variations at mid and low<br />\n\t\t\tlatitudes (Sq and EEJ) and its induced counterpart</td>\n\t\t</tr>\n\t\t<tr>\n\t\t\t<td>Input data</td>\n\t\t\t<td>MAGx_LR_1B, AUX_KP__2_, AUX_DST_2_, AUX_F10_2_, AUX_IMF_2,<br />\n\t\t\tAUX_COR_2_, AUX_OBS_2_, AUX_LIT_2_, AUX_IGR_2_, MCO_SHA_2F,<br />\n\t\t\tMCO_SHAi2D, MLI_SHAi2D, MCO_SHAi2C, MLI_SHAi2C, MMA_SHAi2C,<br />\n\t\t\tMMA_SHA_2F, Q3D_CI_i2, and other non-Swarm data</td>\n\t\t</tr>\n\t\t<tr>\n\t\t\t<td>Input time span</td>\n\t\t\t<td>3 months to 1 year, to be confirmed and aligned to update rate</td>\n\t\t</tr>\n\t\t<tr>\n\t\t\t<td>Spatial representation</td>\n\t\t\t<td>Spherical Harmonics up to degree 60 and order 12 in dipole coordinates</td>\n\t\t</tr>\n\t\t<tr>\n\t\t\t<td>Time representation</td>\n\t\t\t<td>Fourier Series, seasonal and daily periodicity</td>\n\t\t</tr>\n\t\t<tr>\n\t\t\t<td>Units</td>\n\t\t\t<td>nT</td>\n\t\t</tr>\n\t\t<tr>\n\t\t\t<td>Resolution</td>\n\t\t\t<td>1 fT</td>\n\t\t</tr>\n\t\t<tr>\n\t\t\t<td>Uncertainty</td>\n\t\t\t<td>Refer to product quality report</td>\n\t\t</tr>\n\t\t<tr>\n\t\t\t<td>Quality indicator</td>\n\t\t\t<td>Statistics of data misfits provided in the validation report</td>\n\t\t</tr>\n\t\t<tr>\n\t\t\t<td>Data volume</td>\n\t\t\t<td>~ 3.5 Mo&#39;</td>\n\t\t</tr>\n\t\t<tr>\n\t\t\t<td>Data format</td>\n\t\t\t<td>ASCII listing</td>\n\t\t</tr>\n\t\t<tr>\n\t\t\t<td>Output data</td>\n\t\t\t<td>Coefficients of SH model in dipole coordinates, with seasonal and diurnal periodicity</td>\n\t\t</tr>\n\t\t<tr>\n\t\t\t<td>Output time span</td>\n\t\t\t<td>N/A</td>\n\t\t</tr>\n\t\t<tr>\n\t\t\t<td>Update rate</td>\n\t\t\t<td>First after 6 months, 1 year, and update every year</td>\n\t\t</tr>\n\t\t<tr>\n\t\t\t<td>Latency</td>\n\t\t\t<td>1.5 months</td>\n\t\t</tr>\n\t\t<tr>\n\t\t\t<td>Notes</td>\n\t\t\t<td>&nbsp;</td>\n\t\t</tr>\n\t</tbody>\n</table>",
    "changelog": "",
    "fast_processing": false
}
