{
    "product_id": "GF_TECxTMS_2F",
    "definition": "Time series of the ionospheric Total Electron Content (TEC) derived for GRACE-FO 1 and 2 satellites",
    "applicable_missions": [
        "GRACE-FO"
    ],
    "applicable_spacecraft": [
        "GRACE-FO-1",
        "GRACE-FO-2"
    ],
    "thematic_areas": [
        "Space Weather",
        "Ionosphere/Magnetosphere"
    ],
    "authors": [
        {
            "name": "European Space Agency",
            "ror": "https://ror.org/03wd9za21"
        },
        {
            "name": "GFZ Helmholtz Centre for Geosciences",
            "ror": "https://ror.org/04z8jg394"
        }
    ],
    "creation_year": 2022,
    "product_types": [
        "GF_OPER_TEC1TMS_2F",
        "GF_OPER_TEC2TMS_2F"
    ],
    "identifiers": [
        {
            "identifier": "https://swarmhandbook.earth.esa.int/catalogue/GF_TECxTMS_2F",
            "identifierType": "URL"
        },
        {
            "identifier": "10.57780/esa-5b497d1",
            "identifierType": "DOI",
            "role": "concept",
            "primary": true,
            "citation": {
                "text": "European Space Agency, GFZ Helmholtz Centre for Geosciences, 2022, \"GF_TECxTMS_2F\", European Space Agency, https://doi.org/10.57780/esa-5b497d1",
                "bibtex": "@misc{GF_TECxTMS_2F,\n  author = {{European Space Agency} and {GFZ Helmholtz Centre for Geosciences}},\n  title = {GF_TECxTMS_2F},\n  year = {2022},\n  publisher = {European Space Agency},\n  doi = {10.57780/esa-5b497d1},\n  url = {https://doi.org/10.57780/esa-5b497d1},\n}"
            }
        }
    ],
    "description": "Integrated electron density along the line of sight from GRACE-FO 1 and 2 to GNSS satellites",
    "link_files_http": "https://swarm-diss.eo.esa.int/#swarm/Multimission/GRACE-FO/TEC",
    "link_files_ftp": "ftp://swarm-diss.eo.esa.int/Multimission/GRACE-FO/TEC",
    "link_vires_gui": "",
    "link_notebook": "",
    "link_hapi": "",
    "variables_table": "\"Variable Name\",\"Type\",\"Dim\",\"Unit\",\"Description\"\n\"Timestamp\",\"CDF_EPOCH\",\"1\",\"ms\",\"Time of observation, UTC\"\n\"Latitude\",\"CDF_DOUBLE\",\"1\",\"deg\",\"GRACE-FO position in ITRF – Geocentric latitude\"\n\"Longitude\",\"CDF_DOUBLE\",\"1\",\"deg\",\"GRACE-FO position in ITRF – Geocentric longitude\"\n\"Radius\",\"CDF_DOUBLE\",\"1\",\"m\",\"GRACE-FO position in ITRF – Geocentric radius (from the Earth centre)\"\n\"GPS_Position\",\"CDF_DOUBLE\",\"3\",\"m\",\"X-, Y-, Z-coordinates of the GPS satellite\"\n\"LEO_Position\",\"CDF_DOUBLE\",\"3\",\"m\",\"X-, Y-, Z-coordinates of the GRACE-FO satellite\"\n\"PRN\",\"CDF_UINT2\",\"1\",\"N/A\",\"Pseudorandom noise (PRN) code of GPS satellite\"\n\"L1\",\"CDF_DOUBLE\",\"1\",\"m\",\"GPS L1C (LA in RINEX v.2.20) carrier phase observation\"\n\"L2\",\"CDF_DOUBLE\",\"1\",\"m\",\"GPS L2W (L2 in RINEX v.2.20) carrier phase observation\"\n\"P1\",\"CDF_DOUBLE\",\"1\",\"m\",\"GPS C1W (P1 in RINEX v.2.20) code phase observation\"\n\"P2\",\"CDF_DOUBLE\",\"1\",\"m\",\"GPS C2W (P2 in RINEX v.2.20) code phase observation\"\n\"S1_C_N0\",\"CDF_DOUBLE\",\"1\",\"dB-Hz\",\"GPS S1 carrier-to-noise density C/N0 [AD-4] (Sect. 3.1.2.2)\"\n\"S2_C_N0\",\"CDF_DOUBLE\",\"1\",\"dB-Hz\",\"GPS S2 carrier-to-noise density C/N0 [AD-4] (Sect. 3.1.2.2)\"\n\"Absolute_STEC\",\"CDF_DOUBLE\",\"1\",\"TECU\",\"Absolute slant TEC\"\n\"Absolute_VTEC\",\"CDF_DOUBLE\",\"1\",\"TECU\",\"Absolute vertical TEC\"\n\"Elevation_Angle\",\"CDF_DOUBLE\",\"1\",\"deg\",\"Elevation angle\"\n\"Relative_STEC\",\"CDF_DOUBLE\",\"1\",\"TECU\",\"Relative slant TEC\"\n\"Relative_STEC_RMS\",\"CDF_DOUBLE\",\"1\",\"TECU\",\"Root mean square of relative slant TEC2\"\n\"DCB\",\"CDF_DOUBLE\",\"1\",\"TECU\",\"GPS receiver differential code bias (DCB3) (P2–P1)\"\n\"DCB_Error\",\"CDF_DOUBLE\",\"1\",\"TECU\",\"Post fit RMS of the least square system using pairs of mapped slant TEC\"",
    "related_resources": "<ul>\n\t<li><a href=\"https://earth.esa.int/eogateway/activities/tiro\">TIRO Project</a></li>\n</ul>",
    "details": "",
    "changelog": "",
    "fast_processing": false
}
