{
    "product_id": "SW_STRxATT_1B",
    "definition": "Attitude of spacecraft",
    "applicable_missions": [
        "Swarm"
    ],
    "applicable_spacecraft": [
        "Swarm-A",
        "Swarm-B",
        "Swarm-C"
    ],
    "thematic_areas": [
        "Attitude information"
    ],
    "authors": [
        {
            "name": "European Space Agency",
            "ror": "https://ror.org/03wd9za21"
        },
        {
            "name": "Swarm PDGS",
            "ror": ""
        }
    ],
    "creation_year": 2013,
    "product_types": [
        "SW_OPER_STRAATT_1B",
        "SW_OPER_STRBATT_1B",
        "SW_OPER_STRCATT_1B"
    ],
    "identifiers": [
        {
            "identifier": "https://swarmhandbook.earth.esa.int/catalogue/SW_STRxATT_1B",
            "identifierType": "URL"
        },
        {
            "identifier": "10.57780/esa-cc563ac",
            "identifierType": "DOI",
            "role": "concept",
            "primary": true,
            "citation": {
                "text": "European Space Agency, Swarm PDGS, 2013, \"SW_STRxATT_1B\", European Space Agency, https://doi.org/10.57780/esa-cc563ac",
                "bibtex": "@misc{SW_STRxATT_1B,\n  author = {{European Space Agency} and {Swarm PDGS}},\n  title = {SW_STRxATT_1B},\n  year = {2013},\n  publisher = {European Space Agency},\n  doi = {10.57780/esa-cc563ac},\n  url = {https://doi.org/10.57780/esa-cc563ac},\n}"
            }
        }
    ],
    "description": "The STRxATT_1B Product contains attitude information at S/C level based on STR data.",
    "link_files_http": "https://swarm-diss.eo.esa.int/#swarm/Level1b/Latest_baselines/STRxATT",
    "link_files_ftp": "ftp://swarm-diss.eo.esa.int/Level1b/Latest_baselines/STRxATT",
    "link_vires_gui": "",
    "link_notebook": "",
    "link_hapi": "",
    "variables_table": "Variable,Units,Description,Dim,Type\nTimestamp,-,Time stamp,1,CDF_EPOCH\nSyncStatus,-,Synchronization status,1,CDF_UINT2\nq,-,\"Quaternion, transformation: ITRF <- S/C\",4,CDF_DOUBLE\nFlags_q,-,\"Flags characterizing the attitude information,\",1,CDF_UINT1\nManeuver_Id,-,Current maneuver identification code,1,CDF_UINT1\n",
    "related_resources": "<p><strong>Level 1B Product Descriptions:</strong></p>\n\n<ul>\n\t<li><a href=\"https://earth.esa.int/eogateway/documents/20142/37627/swarm-level-1b-processor-algorithms.pdf/e0606842-41ca-fa48-0a40-05a0d4824501\">Swarm Level 1B Processor Algorithms</a></li>\n\t<li><a href=\"https://earth.esa.int/eogateway/documents/20142/37627/swarm-level-1b-product-definition-specification.pdf/12995649-fbcb-6ae2-5302-2269fecf5a08\">Swarm Level 1B Product Definition</a></li>\n</ul>\n\n<p><strong>Level 1B Product Format page:</strong></p>\n\n<ul>\n\t<li><a href=\"https://earth.esa.int/eogateway/missions/swarm/product-data-handbook/level-1b-product-format\">Swarm Level 1B Product Format</a></li>\n</ul>\n",
    "details": "<table border=\"1\">\n\t<caption>Meaning of Flags_q in the data product</caption>\n\t<thead>\n\t\t<tr>\n\t\t\t<th>Flag</th>\n\t\t\t<th>Value</th>\n\t\t\t<th>Description</th>\n\t\t</tr>\n\t</thead>\n\t<tbody>\n\t\t<tr>\n\t\t\t<td rowspan=\"39\">Flags_q</td>\n\t\t\t<td>0</td>\n\t\t\t<td>Attitude information (STR) nominal</td>\n\t\t</tr>\n\t\t<tr>\n\t\t\t<td>1</td>\n\t\t\t<td>Lack of 1 or 2 attitudes of CHU1 in 4 nearest STR samples</td>\n\t\t</tr>\n\t\t<tr>\n\t\t\t<td>2</td>\n\t\t\t<td>Lack of 1 or 2 attitudes of CHU2 in 4 nearest STR samples</td>\n\t\t</tr>\n\t\t<tr>\n\t\t\t<td>3</td>\n\t\t\t<td>Lack of 1 or 2 attitudes of CHU3 in 4 nearest STR samples</td>\n\t\t</tr>\n\t\t<tr>\n\t\t\t<td>4</td>\n\t\t\t<td>Lack of 3 or 4 attitudes of CHU1 in 4 nearest STR samples</td>\n\t\t</tr>\n\t\t<tr>\n\t\t\t<td>5</td>\n\t\t\t<td>Lack of 3 or 4 attitudes of CHU2 in 4 nearest STR samples</td>\n\t\t</tr>\n\t\t<tr>\n\t\t\t<td>6</td>\n\t\t\t<td>Lack of 3 or 4 attitudes of CHU3 in 4 nearest STR samples</td>\n\t\t</tr>\n\t\t<tr>\n\t\t\t<td>7</td>\n\t\t\t<td>Not currently used</td>\n\t\t</tr>\n\t\t<tr>\n\t\t\t<td>8</td>\n\t\t\t<td>On-ground aberrational correction of any attitude sample among 4 nearest STR samples.</td>\n\t\t</tr>\n\t\t<tr>\n\t\t\t<td>9-14</td>\n\t\t\t<td>As 1-7 above with on-ground aberrational correction of any attitude sample among 4 nearest STR samples.</td>\n\t\t</tr>\n\t\t<tr>\n\t\t\t<td>15</td>\n\t\t\t<td>Not currently used</td>\n\t\t</tr>\n\t\t<tr>\n\t\t\t<td>16</td>\n\t\t\t<td>CHU1 obscured by bright object in 4 nearest STR samples (all 4 CHU1 samples invalid), CHU2 and CHU3 ok</td>\n\t\t</tr>\n\t\t<tr>\n\t\t\t<td>17</td>\n\t\t\t<td>CHU2 obscured by bright object in 4 nearest STR samples (all 4 CHU2 samples invalid) , CHU1 and CHU3 ok</td>\n\t\t</tr>\n\t\t<tr>\n\t\t\t<td>18</td>\n\t\t\t<td>CHU3 obscured by bright object in 4 nearest STR samples (all 4 CHU3 samples invalid) , CHU1 and CHU2 ok</td>\n\t\t</tr>\n\t\t<tr>\n\t\t\t<td>19</td>\n\t\t\t<td>Lack of 2-4 attitudes of CHU1 and CHU2 in 4 nearest STR samples, but not both simultaneously</td>\n\t\t</tr>\n\t\t<tr>\n\t\t\t<td>20</td>\n\t\t\t<td>Lack of 2-4 attitudes of CHU1 and CHU3 in 4 nearest STR samples, but not both simultaneously</td>\n\t\t</tr>\n\t\t<tr>\n\t\t\t<td>21</td>\n\t\t\t<td>Lack of 2-4 attitudes of CHU2 and CHU3 in 4 nearest STR samples, but not both simultaneously</td>\n\t\t</tr>\n\t\t<tr>\n\t\t\t<td>22</td>\n\t\t\t<td>Lack of 3-4 attitudes of CHU1, CHU2, and CHU3 in 4 nearest STR samples, but not two simultaneously</td>\n\t\t</tr>\n\t\t<tr>\n\t\t\t<td>23</td>\n\t\t\t<td>Not currently used</td>\n\t\t</tr>\n\t\t<tr>\n\t\t\t<td>24-30</td>\n\t\t\t<td>As 16-22 above with on-ground aberrational correction.</td>\n\t\t</tr>\n\t\t<tr>\n\t\t\t<td>31</td>\n\t\t\t<td>Not currently used</td>\n\t\t</tr>\n\t\t<tr>\n\t\t\t<td>32</td>\n\t\t\t<td>1 or 2 attitudes based on CHU1 alone (CHU2 and CHU3 missing) in 4 nearest STR samples</td>\n\t\t</tr>\n\t\t<tr>\n\t\t\t<td>33</td>\n\t\t\t<td>1 or 2 attitudes based on CHU2 alone in 4 nearest STR samples</td>\n\t\t</tr>\n\t\t<tr>\n\t\t\t<td>34</td>\n\t\t\t<td>1 or 2 attitudes based on CHU3 alone in 4 nearest STR samples</td>\n\t\t</tr>\n\t\t<tr>\n\t\t\t<td>35</td>\n\t\t\t<td>2 attitudes based on single, intermittent CHU alone in 4 nearest STR samples</td>\n\t\t</tr>\n\t\t<tr>\n\t\t\t<td>36-39</td>\n\t\t\t<td>Not currently used</td>\n\t\t</tr>\n\t\t<tr>\n\t\t\t<td>40-43</td>\n\t\t\t<td>As 32-35 above with on-ground aberrational correction.</td>\n\t\t</tr>\n\t\t<tr>\n\t\t\t<td>44-47</td>\n\t\t\t<td>Not currently used</td>\n\t\t</tr>\n\t\t<tr>\n\t\t\t<td>48</td>\n\t\t\t<td>1 attitude sample missing among 4 nearest STR samples (data gap)</td>\n\t\t</tr>\n\t\t<tr>\n\t\t\t<td>49</td>\n\t\t\t<td>2 attitude samples missing among 4 nearest STR samples</td>\n\t\t</tr>\n\t\t<tr>\n\t\t\t<td>50</td>\n\t\t\t<td>3 or more attitude samples missing among 4 nearest STR samples</td>\n\t\t</tr>\n\t\t<tr>\n\t\t\t<td>51</td>\n\t\t\t<td>3 or 4 attitudes based on CHU1 alone in 4 nearest STR samples</td>\n\t\t</tr>\n\t\t<tr>\n\t\t\t<td>52</td>\n\t\t\t<td>3 or 4 attitudes based on CHU2 alone in 4 nearest STR samples</td>\n\t\t</tr>\n\t\t<tr>\n\t\t\t<td>53</td>\n\t\t\t<td>3 or 4 attitudes based on CHU3 alone in 4 nearest STR samples</td>\n\t\t</tr>\n\t\t<tr>\n\t\t\t<td>54</td>\n\t\t\t<td>3 or 4 attitudes based on single, intermittent CHU alone in 4 nearest STR samples</td>\n\t\t</tr>\n\t\t<tr>\n\t\t\t<td>55</td>\n\t\t\t<td>Not currently used</td>\n\t\t</tr>\n\t\t<tr>\n\t\t\t<td>56-62</td>\n\t\t\t<td>As 48-54 above with on-ground aberrational correction.</td>\n\t\t</tr>\n\t\t<tr>\n\t\t\t<td>63-254</td>\n\t\t\t<td>Not currently used</td>\n\t\t</tr>\n\t\t<tr>\n\t\t\t<td>255</td>\n\t\t\t<td>Not enough STR data for generating attitude information.</td>\n\t\t</tr>\n\t</tbody>\n</table>\n",
    "changelog": "",
    "fast_processing": false
}
