{
    "product_id": "SW_EEFxTMS_2F",
    "definition": "Dayside equatorial electric field",
    "applicable_missions": [
        "Swarm"
    ],
    "applicable_spacecraft": [
        "Swarm-A",
        "Swarm-B",
        "Swarm-C"
    ],
    "thematic_areas": [
        "Ionosphere/Magnetosphere",
        "Space Weather"
    ],
    "authors": [
        {
            "name": "European Space Agency",
            "ror": "https://ror.org/03wd9za21"
        },
        {
            "name": "University of Colorado Boulder",
            "ror": "https://ror.org/02ttsq026"
        },
        {
            "name": "Technical University of Denmark",
            "ror": "https://ror.org/04qtj9h94"
        }
    ],
    "creation_year": 2020,
    "product_types": [
        "SW_OPER_EEFATMS_2F",
        "SW_OPER_EEFBTMS_2F",
        "SW_OPER_EEFCTMS_2F"
    ],
    "identifiers": [
        {
            "identifier": "https://swarmhandbook.earth.esa.int/catalogue/SW_EEFxTMS_2F",
            "identifierType": "URL"
        },
        {
            "identifier": "10.57780/esa-7d59fd1",
            "identifierType": "DOI",
            "role": "concept",
            "primary": true,
            "citation": {
                "text": "European Space Agency, University of Colorado Boulder, Technical University of Denmark, 2020, \"SW_EEFxTMS_2F\", European Space Agency, https://doi.org/10.57780/esa-7d59fd1",
                "bibtex": "@misc{SW_EEFxTMS_2F,\n  author = {{European Space Agency} and {University of Colorado Boulder} and {Technical University of Denmark}},\n  title = {SW_EEFxTMS_2F},\n  year = {2020},\n  publisher = {European Space Agency},\n  doi = {10.57780/esa-7d59fd1},\n  url = {https://doi.org/10.57780/esa-7d59fd1},\n}"
            }
        }
    ],
    "description": "Estimate of eastward equatorial electric field component, by using magnetic measurements of the equatorial electrojet (EEJ) current as the satellites fly overhead. Since the magnetic signal of the EEJ current is directly measured by the satellite, this product also provides an estimate of the EEJ current strength.",
    "link_files_http": "https://swarm-diss.eo.esa.int/#swarm/Level2daily/Latest_baselines/EEF/TMS",
    "link_files_ftp": "ftp://swarm-diss.eo.esa.int/Level2daily/Latest_baselines/EEF/TMS",
    "link_vires_gui": "https://vires.services?ws=data%3Aapplication/json%2Bgzip%3Bbase64%2CH4sIAMta5mMC/51UbW/aMBD%2BKyifIfLZcRzzDSjsC3RdyzZpCEVucKm3kCAnoG4V/31np0BKq0mdFOmce3nu8d35noNK273J9DdtK1MWQb8TsBAgJEG3g7ZcZ7VeTUxeazs1VY32RTBxtmF63YhxI0ZOXKEHii9XU%2BUPs%2BnciUmu1lU6OR%2BH/phqa0vrjuPxJFiirM1G3/mkDZdFQAnEPQL4zQnp%2By8khPxwUSebmFPWZ1GfRiFItB2hrsqNMicc3gPao8kcSJ%2BLPhFhQvlrHOlsNO5TGkZcNjhbW652WV2NyuLBrHdWvVB7Du6%2Bp59vxrfpbPBpkE5vUxh69d5U5j7XeH5QeaURotzVuSl01VZtVWbq36gBl0NZtdFY4sojYGnHI3%2Byqlg7pAVwvHS3w51wrLIyL22VKZ8n%2BKnr4OAq%2BtGgVo9RVdudPjStHY9Sq6vBBYte7PDif1J4afWrOAyinL8N2uaq2qhW3PBjcQcXeWwDztBgPrtL6eSiDe5a/9EFN5Ovb49O8JbMyuy1XZtincJ79WxIZohs1U1ZmdP4bM8/C6BxnMgoCSGKWSI5F91ODwiQWAgR0shpeYLVYDQhwEIJCSExOjs6K2PPD6ZHQiFYxBlQxolIEh51OySMQRAqhQSAREoPTzAZxwSURSKhSRQ3ld5tX2AAWEQolQmQCADdHA6RJEJO0j0nGUnKnVIidQoCcRnjkZAOxpr1o98WmJuyGO/HEgEyYuAiRIKAlDEJFGeTusuGnCKDOOZIWXJJqO5BvHS1exo8maq9FQLcLqberbSr9zYv68u3uXgOfrsg//KPu8Vrpupe56gudnnudPTotjz9Xbj4Zh%2B9nG7ZVlIfe3C6B78kq5kpzMb88QNwnDOfevxU66JuozT53tF7GmX2y4MsPEqL31tDpWqd56bWzeQO8u2jOg/%2B0Kp92WIzelQ2N%2B0FdX03av19xZKqE/3D4S%2BMGg/CJAYAAA%3D%3D",
    "link_notebook": "",
    "link_hapi": "http://hapi-server.org/servers/#server=VirES-for-Swarm&dataset=SW_OPER_EEFATMS_2F",
    "variables_table": "Variable,Units,Description,Dim,Type\nTimestamp,-,\"Time of satellite crossing of the magnetic equator, UTC\",1,CDF_EPOCH\nLongitude,degrees,Geographic longitude of satellite crossing of the magnetic equator,1,CDF_REAL8\nLatitude,degrees,Geographic latitude of satellite crossing of the magnetic equator,1,CDF_REAL8\nEEF,mV/m,Estimate of the equatorial electric field,1,CDF_REAL8\nEEJ_meast,A/km,\"Height-integrated magnetic eastward current profile, spanning [-20:0.5:20] degrees QD latitude\",81,CDF_REAL8\nEEJ_mnorth,A/km,\"Height-integrated magnetic northward current profile, spanning [-20:0.5:20] degrees QD latitude\",81,CDF_REAL8\nRelErr,-,Quality indicator of EEF estimate; relative error between modeled and observed current profile,1,CDF_REAL8\nFlags,-,Flags describing data gaps and satellite identification,1,CDF_UINT2\nTimestamp_Track,-,\"Timestamps along track, length provided in Length_Track\",3000,CDF_EPOCH\nLatitude_Track,degrees,\"Latitudes along track, length provided in Length_Track\",3000,CDF_REAL8\nLongitude_Track,degress,\"Longitudes along track, length provided in Length_Track\",3000,CDF_REAL8\nRadius_Track,km,\"Geocentric radii along track, length provided in Length_Track\",3000,CDF_REAL8\nKsq_Track,A/km,\"Surface current of estimated Sq signal, packed in geocentric north,east components,, length 2*Length_Track\",6000,CDF_REAL8\nKeej_Track,A/km,\"Surface current of estimated EEJ signal, packed in geocentric north,east components,, length 2*Length_Track\",6000,CDF_REAL8\nLength_Track,-,Array of track lengths,1,CDF_UINT4",
    "related_resources": "<ul>\n<li><a href=\"https://earth.esa.int/eogateway/documents/20142/37627/Swarm-Equatorial-Electric-Field-Level-2-Product.pd\">Swarm equatorial electric field (EEF)</a></li>\n</ul>",
    "details": "<table>\n    <tr>\n        <td>Product Identifier</td>\n        <td>EEFxTMS_2F</td>\n    </tr>\n    <tr>\n        <td>Definition</td>\n        <td>Dayside equatorial electric field</td>\n    </tr>\n    <tr>\n        <td>Input Data</td>\n        <td>MCO_SHA_2X, AUX_LIT_2, AUX_IGR_2</td>\n    </tr>\n    <tr>\n        <td>Input Time Span</td>\n        <td>Every dayside equator crossing &plusmn;20 minutes</td>\n    </tr>\n    <tr>\n        <td>Spatial Representation</td>\n        <td>One longitude/latitude pair (on the magnetic equator) for each output value</td>\n    </tr>\n    <tr>\n        <td>Time Representation</td>\n        <td>Single values at time of dayside equator crossing</td>\n    </tr>\n    <tr>\n        <td>Units</td>\n        <td>mV/m</td>\n    </tr>\n    <tr>\n        <td>Resolution</td>\n        <td>0.1 mV/m</td>\n    </tr>\n    <tr>\n        <td>Uncertainty</td>\n        <td>0.1 mV/m</td>\n    </tr>\n    <tr>\n        <td>Quality Indicator</td>\n        <td>Relative error between modeled and observed current profile</td>\n    </tr>\n    <tr>\n        <td>Data Volume</td>\n        <td>&lt; 10 MB</td>\n    </tr>\n    <tr>\n        <td>Output Data</td>\n        <td>CDF file with time series</td>\n    </tr>\n    <tr>\n        <td>Output Time Span</td>\n        <td>Continuous for entire mission. One value for each day-side equator crossing (90 minute sampling for day-night local time orbits, 45 minutes for dawn-dusk orbits)</td>\n    </tr>\n    <tr>\n        <td>Update Rate</td>\n        <td>One output file per day</td>\n    </tr>\n    <tr>\n        <td>Latency</td>\n        <td>30 hours</td>\n    </tr>\n    <tr>\n        <td>Notes</td>\n        <td>The EEJ_meast and EEJ_mnorth vectors have length 81 and correspond to quasi-dipole (QD) latitudes ranging from -20° to +20° in steps of 0.5°. So for example, the corresponding QD latitude vector could be constructed using the following MATLAB syntax: qdvec = [-20:0.5:20]. The EEJ_meast profile is the projection of the EEJ current along the QD F1 basis vector. The EEJ_mnorth profile is the projection of the EEJ current along the QD F2 basis vector.<br>The variables with suffix _Track have variable lengths depending upon the value in Length_Track</td>\n    </tr>\n</table>",
    "changelog": "<p>\n    <strong>Version 0502</strong>\n</p>\n<p>\n    Old variables (version 0501):\n</p>\n<pre style=\"background-color:#f8f8f8;border-radius:4px;border:1px solid #dddddd;font-family:Monaco, Menlo, Consolas, &quot;Courier New&quot;, monospace;font-size:12px;margin:8px 0;padding:8px 12px;white-space:pre-wrap;\">Timestamp             CDF_EPOCH/1       0:[]    T/  \nLatitude              CDF_REAL8/1       0:[]    T/  \nLongitude             CDF_REAL8/1       0:[]    T/  \nEEJ                   CDF_REAL8/1       1:[81]  T/T\nEEF                   CDF_REAL8/1       0:[]    T/  \nRelErr                CDF_REAL8/1       0:[]    T/  \nFlags                 CDF_UINT2/1       0:[]    T/ </pre>\n<p>\n    New variables (version 0502):\n</p>\n<pre style=\"background-color:#f8f8f8;border-radius:4px;border:1px solid #dddddd;font-family:Monaco, Menlo, Consolas, &quot;Courier New&quot;, monospace;font-size:12px;margin:8px 0;padding:8px 12px;white-space:pre-wrap;\">Timestamp             CDF_EPOCH/1       0:[]    T/  \nLatitude              CDF_REAL8/1       0:[]    T/  \nLongitude             CDF_REAL8/1       0:[]    T/  \nEEJ_meast             CDF_REAL8/1       1:[81]  T/T\nEEJ_mnorth            CDF_REAL8/1       1:[81]  T/T\nEEF                   CDF_REAL8/1       0:[]    T/  \nRelErr                CDF_REAL8/1       0:[]    T/  \nFlags                 CDF_UINT2/1       0:[]    T/  \nTimestamp_Track       CDF_EPOCH/1       1:[3000]        T/T\nLatitude_Track        CDF_REAL8/1       1:[3000]        T/T\nLongitude_Track       CDF_REAL8/1       1:[3000]        T/T\nRadius_Track          CDF_REAL8/1       1:[3000]        T/T\nKsq_Track             CDF_REAL8/1       1:[6000]        T/T\nKeej_Track            CDF_REAL8/1       1:[6000]        T/T\nLength_Track          CDF_UINT4/1       0:[]    T/</pre>",
    "fast_processing": false
}
