{
    "product_id": "SW_PC1xMAG_2F",
    "definition": "Swarm Pc1 wave characterisation from HR Vector Magnetometer Data",
    "applicable_missions": [
        "Swarm"
    ],
    "applicable_spacecraft": [
        "Swarm-A",
        "Swarm-B",
        "Swarm-C"
    ],
    "thematic_areas": [
        "Ionosphere/Magnetosphere",
        "Space Weather"
    ],
    "authors": [
        {
            "name": "European Space Agency",
            "ror": "https://ror.org/03wd9za21"
        },
        {
            "name": "HUN-REN Institute of Earth Physics and Space Science",
            "ror": "https://ror.org/05c9vr219"
        }
    ],
    "creation_year": 2025,
    "product_types": [
        "SW_OPER_PC1AMAG_2F",
        "SW_OPER_PC1BMAG_2F",
        "SW_OPER_PC1CMAG_2F"
    ],
    "identifiers": [
        {
            "identifier": "https://swarmhandbook.earth.esa.int/catalogue/SW_PC1xMAG_2F",
            "identifierType": "URL"
        },
        {
            "identifier": "10.57780/esa-8b69b15",
            "identifierType": "DOI",
            "role": "concept",
            "primary": true,
            "citation": {
                "text": "European Space Agency, HUN-REN Institute of Earth Physics and Space Science, 2025, \"SW_PC1xMAG_2F\", European Space Agency, https://doi.org/10.57780/esa-8b69b15",
                "bibtex": "@misc{SW_PC1xMAG_2F,\n  author = {{European Space Agency} and {HUN-REN Institute of Earth Physics and Space Science}},\n  title = {SW_PC1xMAG_2F},\n  year = {2025},\n  publisher = {European Space Agency},\n  doi = {10.57780/esa-8b69b15},\n  url = {https://doi.org/10.57780/esa-8b69b15},\n}"
            }
        }
    ],
    "description": "The Swarm-ULF product package consists of two independent L2 products. The ULFxMAG_2F product contains information on the instantaneous power, prominence, frequency, etc. of Pc2, Pc3, Pc4 and Pi2 events, the average event properties (e.g., mean frequency, power and duration) as well as minute resolution time series of the rms of the total field filtered in the various ULF bands. The satellite positions are given in both in geographic and QD magnetic coordinates. Auxiliary data, such as time of observation, magnetic local time, and the solar zenith angle complement ULF wave characterisation. Similarly, the PC1xMAG_2F product contains the characterisation of Pc1 events derived from the HR vector magnetic field data.",
    "link_files_http": "https://swarm-diss.eo.esa.int/#swarm/Level2daily/Latest_baselines/PC1/MAG",
    "link_files_ftp": "ftp://swarm-diss.eo.esa.int/Level2daily/Latest_baselines/PC1/MAG",
    "link_vires_gui": "",
    "link_notebook": "",
    "link_hapi": "",
    "variables_table": "\"Variable Name\",\"Type\",\"Dimension\",\"Unit\",\"Description\"\n\"ORB_C\",\"CDF_UINT4\",\"1\",\"-\",\"Orbit number for the Bp/Ba/Br component ID event (where ID is the event identifier ID_C, see below) and C stands for any of the three components\"\n\"DIR_C\",\"CDF_INT1\",\"1\",\"-\",\"Flight direction for the Bp/Ba/Br component ID event (1: ascending, -1: descending)\"\n\"ID_C\",\"CDF_UINT1\",\"1\",\"-\",\"Bp/Ba/Br component event identifier\"\n\"Timestamp_C\",\"CDF_EPOCH\",\"1\",\"-\",\"Time of observation for the Bp/Ba/Br component ID event, UTC\"\n\"Latitude_C\",\"CDF_DOUBLE\",\"1\",\"deg\",\"Position in ITRF – Geocentric latitude for the Bp/Ba/Br component ID event\"\n\"Longitude_C\",\"CDF_DOUBLE\",\"1\",\"deg\",\"Position in ITRF – Geocentric longitude for the Bp/Ba/Br component ID event\"\n\"Radius_C\",\"CDF_DOUBLE\",\"1\",\"m\",\"Position in ITRF – Geocentric radius for the Bp/Ba/Br component ID event\"\n\"Latitude_QD_C\",\"CDF_DOUBLE\",\"1\",\"deg\",\"QD latitude for the Bp/Ba/Br component ID event\"\n\"Longitude_QD_C\",\"CDF_DOUBLE\",\"1\",\"deg\",\"QD longitude for the Bp/Ba/Br component ID event\"\n\"MLT_C\",\"CDF_DOUBLE\",\"1\",\"hr\",\"Magnetic Local Time for the Bp/Ba/Br component ID event\"\n\"SZA_C\",\"CDF_DOUBLE\",\"1\",\"deg\",\"Solar zenith angle for the Bp/Ba/Br component ID event\"\n\"Frequency_C\",\"CDF_DOUBLE\",\"1\",\"Hz\",\"Instantaneous frequency for the Bp/Ba/Br component ID event\"\n\"Halfwidth_C\",\"CDF_DOUBLE\",\"1\",\"Hz\",\"Instantaneous spectral peak half width for the Bp/Ba/Br component ID event\"\n\"Power_C\",\"CDF_DOUBLE\",\"1\",\"nT²/Hz\",\"Instantaneous power for the Bp/Ba/Br component ID event\"\n\"Prominence_C\",\"CDF_DOUBLE\",\"1\",\"-\",\"Instantaneous prominence for the Bp/Ba/Br component ID event\"\n\"Quality_B_C\",\"CDF_UINT1\",\"1\",\"-\",\"Instantaneous MAGxHR quality for the Bp/Ba/Br component ID event. = Flag_B of the MAGx_HR product, see the documentation ofMAGx_HR for details.\"\n\"Quality_p_C\",\"CDF_UINT1\",\"1\",\"-\",\"Instantaneous peak quality for the Bp/Ba/Br component ID event. 1: primary spectral peak, 2: secondary spectral peak.\"\n\"Quality_n_C\",\"CDF_UINT1\",\"1\",\"-\",\"Instantaneous noise quality for the Bp/Ba/Br component ID event. 0: 1/f type noise not present, 1: 1/f type noise present\"\n\"ORB_m_C\",\"CDF_UINT4\",\"1\",\"-\",\"Orbit number for the Bp/Ba/Br component ID event (mean properties)\"\n\"DIR_m_C\",\"CDF_INT1\",\"1\",\"-\",\"Flight direction for the Bp/Ba/Br component ID event (mean properties)\"\n\"ID_m_C\",\"CDF_UINT1\",\"1\",\"-\",\"Bp/Ba/Br component event identifier for event mean properties\"\n\"Timestamp_m_C\",\"CDF_EPOCH\",\"1\",\"-\",\"Mean time of observation for the Bp/Ba/Br component ID event, UTC\"\n\"Latitude_m_C\",\"CDF_DOUBLE\",\"1\",\"deg\",\"Mean position in ITRF – Geocentric latitude for the Bp/Ba/Br component ID event\"\n\"Longitude_m_C\",\"CDF_DOUBLE\",\"1\",\"deg\",\"Mean position in ITRF – Geocentric longitude for the Bp/Ba/Br component ID event\"\n\"Radius_m_C\",\"CDF_DOUBLE\",\"1\",\"m\",\"Mean position in ITRF – Geocentric radius for the Bp/Ba/Br component ID event\"\n\"Latitude_QD_m_C\",\"CDF_DOUBLE\",\"1\",\"deg\",\"Mean QD latitude for the Bp/Ba/Br component ID event\"\n\"Longitude_QD_m_C\",\"CDF_DOUBLE\",\"1\",\"deg\",\"Mean QD longitude for the Bp/Ba/Br component ID event\"\n\"MLT_m_C\",\"CDF_DOUBLE\",\"1\",\"hr\",\"Mean Magnetic Local Time for the Bp/Ba/Br component ID event\"\n\"SZA_m_C\",\"CDF_DOUBLE\",\"1\",\"deg\",\"Mean Solar zenith angle for the Bp/Ba/Br component ID event\"\n\"Duration_m_C\",\"CDF_DOUBLE\",\"1\",\"min\",\"Duration of the Bp/Ba/Br component ID event\"\n\"Frequency_m_C\",\"CDF_DOUBLE\",\"1\",\"Hz\",\"Mean frequency for the Bp/Ba/Br component ID event\"\n\"Freq_std_m_C\",\"CDF_DOUBLE\",\"1\",\"Hz\",\"Standard deviation of the spectral peak frequencies for the Bp/Ba/Br component ID event\"\n\"Halfwidth_m_C\",\"CDF_DOUBLE\",\"1\",\"Hz\",\"Mean spectral peak half width for the Bp/Ba/Br component ID event\"\n\"Power_m_C\",\"CDF_DOUBLE\",\"1\",\"nT²/Hz\",\"Mean power for the Bp/Ba/Br component ID event\"\n\"Prominence_m_C\",\"CDF_DOUBLE\",\"1\",\"-\",\"Mean prominence for the Bp/Ba/Br component ID event\"\n\"ROFC_m_C\",\"CDF_DOUBLE\",\"1\",\"Hz/s\",\"Rate of frequency change for the Bp/Ba/Br component ID event\"\n\"Quality_m_C\",\"CDF_UINT1\",\"1\",\"-\",\"Overall quality for the Bp/Ba/Br component ID event. 0: high quality data. 1: not nominal operation of the VFM instrument. 2: low number of primarydata points. 3: contaminated spectra. 4: 1 and 2. 5: 1 and 3. 6: 2 and 3. 7: 1 and 2 and 3\"",
    "related_resources": "<ul>\n<li><a href=\"https://earth.esa.int/eogateway/activities/swarm-ulf-ionosphere\">Swarm ULF project</a></li>\n</ul>",
    "details": "<table><thead>\n  <tr>\n    <th>Product identifier</th>\n    <th>PC1xMAG_2F</th>\n  </tr></thead>\n<tbody>\n  <tr>\n    <td>Definition</td>\n    <td>Pc1 wave characterisation</td>\n  </tr>\n  <tr>\n    <td>Input Data</td>\n    <td>MAGx_HR_2F, AUXxORBCNT</td>\n  </tr>\n  <tr>\n    <td>Input Time Span</td>\n    <td>One day</td>\n  </tr>\n  <tr>\n    <td>Spatial representation</td>\n    <td>One geographic and QD-latitude/longitude pair</td>\n  </tr>\n  <tr>\n    <td>Time representation</td>\n    <td>UT (~ 15 seconds)</td>\n  </tr>\n  <tr>\n    <td>Resolution</td>\n    <td>0.1 degree for coordinates</td>\n  </tr>\n  <tr>\n    <td>Uncertainty</td>\n    <td>~0.1° for coordinates</td>\n  </tr>\n  <tr>\n    <td>Quality Indicator</td>\n    <td>Three different quality vector flags are introduced (Quality_B, Quality_p, Quality_n) for characterizing the quality of the spectral peaks:<br>- Quality_B contains (interpolated) Flag_B values from the MAGx_HR data files.<br>- Quality_p indicates whether the data point corresponds to a primary or a secondary spectral peak.<br>- Quality_n indicates whether strong 1/f type noise (likely related to field-aligned currents) was present in the original spectrum.<br><br>From the three different quality vector flags introduced to characterize spectral peaks, one single quality vector flag is determined to characterize each Pc1 event. The values of the Quality vector flag are integers ranging from 0 to 7<br></td>\n  </tr>\n  <tr>\n    <td>Data Volume</td>\n    <td>Up to few 100 kB</td>\n  </tr>\n  <tr>\n    <td>Data Format</td>\n    <td>CDF</td>\n  </tr>\n</tbody></table>\n\n<p>Version information of input data is available in the CDF global attributes.</p>\n\n<p>As the event detection is implemented on pole-to-pole segments of the orbit, the event characterisation parameters of the product typically contain some data from the previous day to complement the first orbit fragment of the day into a whole pole-to-pole orbit segment.</p>",
    "changelog": "",
    "fast_processing": false
}
